Jaqueta de couro com efeito de cobra,Giuseppe Zanotti,R$ 5.381,R$ 13.500
Jaqueta de camurça,FURSAC,R$ 7.466,R$ 10.646
Cardigan de jacquard monogramado com zíper,Casablanca,R$ 10.822,R$ 15.441
Jaqueta Ami De Coeur com recortes,AMI Paris,R$ 3.566,R$ 5.913
Blazer com abotoamento simples,Canali,R$ 12.925,R$ 19.861
Jaqueta de couro com zíper,Giuseppe Zanotti,R$ 6.048,R$ 13.500
Jaqueta isolada 180GR,Rossignol,R$ 1.613,R$ 3.180
Jaqueta bomber com logo,Tommy Hilfiger,R$ 2.638,R$ 3.749
Jaqueta de veludo cotelê com recorte jeans,DSQUARED2,R$ 10.625,R$ 15.159
Jaqueta de couro com gola oversized,AMI Paris,R$ 12.713,R$ 25.380
Jaqueta bomber com monograma perfurado,Karl Lagerfeld,R$ 2.684,R$ 5.322
Jaqueta bomber color block com logo,Dolce & Gabbana,R$ 8.100,R$ 13.500
Jaqueta GORE-TEX®,The North Face,R$ 4.433,R$ 6.313
Jaqueta bomber com logo,Kenzo,R$ 7.219,R$ 11.082
Jaqueta esportiva com logo bordado,Palm Angels,R$ 3.700,R$ 9.181
Jaqueta Laurel de plush,Casablanca,R$ 8.777,R$ 13.478
Jaqueta bomber com patch de logo,Balmain,R$ 9.342,R$ 18.800
Jaqueta de couro,FURSAC,R$ 10.126,R$ 12.646
Jaqueta militar com abotoamento,Balmain,R$ 9.586,R$ 21.246
Jaqueta com estampa de logo,Dolce & Gabbana,R$ 8.403,R$ 10.584
Jaqueta com capuz e patch de bússola,Stone Island,R$ 11.266,R$ 13.246
Jaqueta matelassê com padronagem monogramada,Karl Lagerfeld Jeans,R$ 2.023,R$ 4.000
Blazer com abotoamento simples,BOSS,R$ 2.961,R$ 4.230
Jaqueta jeans com placa de logo,Dolce & Gabbana,R$ 12.219,R$ 16.278
Jaqueta matelassê com logo no busto,DSQUARED2,R$ 14.326,R$ 15.913
Camisa Timber de algodão xadrez,Woolrich,R$ 3.882,R$ 5.948
Jaqueta de linho com abotoamento,Ferragamo,R$ 8.202,R$ 16.500
Jaqueta com patch de logo,DSQUARED2,R$ 13.600,R$ 20.899
Blazer com abotoamento duplo,Balmain,R$ 19.382,R$ 27.670
Jaqueta x Carhartt em canvas,Junya Watanabe MAN,R$ 7.258,R$ 16.073
Jaqueta jeans com patchwork,AMBUSH,R$ 3.808,R$ 6.886
Bones appliqué-detail varsity jacket,AMIRI,R$ 12.108,R$ 20.149
Jaqueta matelassê,Rossignol,R$ 1.613,R$ 3.180
Jaqueta bomber Ami De Coeur,AMI Paris,R$ 7.086,R$ 11.780
Jaqueta com placa de logo,AMI Paris,R$ 4.851,R$ 6.911
Jaqueta matelassê color block,Casablanca,R$ 10.456,R$ 20.866
Jaqueta com patch de logo,Casablanca,R$ 12.612,R$ 17.998
Blazer xadrez com abotoamento simples,Canali,R$ 23.788,R$ 25.038
Jaqueta Truro com capuz e logo,Polo Ralph Lauren,R$ 6.017,R$ 11.989
Jaqueta de plush com zíper,Casablanca,R$ 13.145,R$ 17.512
Jaqueta matelassê Versace Allover com logo,Versace,R$ 16.680,R$ 27.769
Jaqueta Polo Pony matelassê,Polo Ralph Lauren,R$ 4.568,R$ 5.071
Jaqueta bomber de couro,Corneliani,R$ 10.471,R$ 17.422
Jaqueta leve com zíper,Moorer,R$ 11.018,R$ 16.927
Jaqueta com logo bordado,The North Face,R$ 4.748,R$ 7.281
Jaqueta bomber com bordado,Giuseppe Zanotti,R$ 3.318,R$ 7.380
Jaqueta matelassê com recortes,The North Face,R$ 4.443,R$ 4.675
Jaqueta Field com logo bordado,Woolrich,R$ 4.223,R$ 6.473
Jaqueta com patch de logo,Balmain,R$ 6.840,R$ 11.400
Jaqueta matelassê Himalayan com logo bordado,The North Face,R$ 7.954,R$ 8.833
Jaqueta com capuz,Rossignol,R$ 1.746,R$ 3.446
Jaqueta bomber Lucky Tiger com bordado,Kenzo,R$ 9.056,R$ 10.646
Jaqueta jeans Helston,Carhartt WIP,R$ 2.264,R$ 2.656
Jaqueta Luck matelassê,Save The Duck,R$ 3.602,R$ 4.230
Jaqueta matelassê com capuz e mangas removíveis,Burberry,R$ 14.668,R$ 19.542
Jaqueta matelassê com aplicação de logo,AMI Paris,R$ 14.567,R$ 16.181
Jaqueta matelassê com capuz,Tommy Hilfiger,R$ 3.156,R$ 4.489
Jaqueta bomber dupla face color block,Karl Lagerfeld,R$ 2.023,R$ 4.000
Jaqueta Nuptse matelassê 1992,The North Face,R$ 5.219,R$ 8.005
Jaqueta com motivo Polo Pony,Polo Ralph Lauren,R$ 2.127,R$ 3.019
Jaqueta de lã xadrez,AMI Paris,R$ 3.313,R$ 6.580
Jaqueta de couro com logo,Versace Jeans Couture,R$ 6.866,R$ 8.571
Jaqueta com estampa monogramada,Balmain,R$ 6.646,R$ 13.246
Jaqueta com detalhe de listras,There Was One,R$ 1.305,R$ 4.243
Jaqueta Utility com abotoamento,Karl Lagerfeld Jeans,R$ 1.031,R$ 2.017
Jaqueta Milo com zíper,AllSaints,R$ 6.954,R$ 7.318
Jaqueta Himalayan matelassê com zíper,The North Face,R$ 2.919,R$ 3.638
Jaqueta jeans Natlover com capuz,Off-White,R$ 7.603,R$ 12.641
Jaqueta matelassê com patch de logo,Emporio Armani,R$ 5.229,R$ 7.451
Jaqueta matelassê de capuz ajustável,Herno,R$ 11.058,R$ 12.282
Blazer com abotoamento simples,Dolce & Gabbana,R$ 18.188,R$ 25.964
Jaqueta Thor de capuz com logo,Polo Ralph Lauren,R$ 3.671,R$ 6.638
Jaqueta Aidak de couro,Giuseppe Zanotti,R$ 4.402,R$ 12.600
Jaqueta de lã com zíper,Burberry,R$ 16.579,R$ 20.713
Jaqueta térmica 100GR,Rossignol,R$ 1.713,R$ 3.380
Jaqueta matelassê de poliéster reciclado,Axel Arigato,R$ 4.846,R$ 6.904
Jaqueta Tower de camurça com capuz,Barba,R$ 15.744,R$ 22.473
Jaqueta jeans com abotoamento,Diesel,R$ 9.256,R$ 13.203
Jaqueta bomber com patch de logo,Versace,R$ 16.525,R$ 23.587
Jaqueta bomber com zíper,Salvatore Santoro,R$ 13.633,R$ 17.030
Jaqueta com capuz,Rossignol,R$ 1.746,R$ 3.446
Jaqueta bomber de algodão stretch,AllSaints,R$ 2.505,R$ 2.635
Jaqueta com padronagem xadrez,Burberry,R$ 12.219,R$ 16.278
Jaqueta bomber com zíper,Paul & Shark,R$ 6.472,R$ 9.227
Jaqueta matelassê com capuz,DSQUARED2,R$ 9.413,R$ 13.428
Jaqueta impermeável com logo gravado,Herno,R$ 6.383,R$ 7.967
Jaqueta gola alta,Giuseppe Zanotti,R$ 4.402,R$ 12.600
Blazer xadrez com lapelas,ETRO,R$ 18.754,R$ 20.833
Jaqueta de camurça,Barba,R$ 11.318,R$ 12.571
Jaqueta Ative de fleece,Barbour,R$ 2.687,R$ 3.154
Jaqueta de algodão misto,Lanvin,R$ 2.897,R$ 9.550
Jaqueta bomber matelassê,Balmain,R$ 19.382,R$ 27.670
Jaqueta Lhotse matelassê,The North Face,R$ 4.409,R$ 5.500
Jaqueta matelassê dupla face,Emporio Armani,R$ 5.757,R$ 8.205
Jaqueta militar,LEMAIRE,R$ 7.793,R$ 11.113
Jaqueta bomber com monograma,Balmain,R$ 9.313,R$ 18.580
