Produto,Marca,Preço,Preço Original
Jaqueta x 100 Thieves com capuz,adidas,R$ 3.734,R$ 3.895
Jaqueta Glass Cover-TC,Stone Island,R$ 19.542,R$ 26.205
Jaqueta Ami De Coeur de lã virgem,AMI Paris,R$ 6.446,R$ 7.478
Jaqueta esportiva com listras triplas,adidas,R$ 1.524,R$ 3.036
Jaqueta jeans efeito destroyed,Givenchy,R$ 21.805,R$ 30.121
Jaqueta bomber Reps R-NY,Stone Island,R$ 8.046,R$ 9.499
Jaqueta esportiva Varsity,Casablanca,R$ 12.171,R$ 15.323
Jaqueta de pelos com patch de logo,Marni,R$ 13.044,R$ 17.594
Jaqueta matelassê com patch de bússola,Stone Island,R$ 7.777,R$ 8.639
Jaqueta matelassê camuflada,Andersson Bell,R$ 3.789,R$ 8.405
Jaqueta Retro Denali,The North Face,R$ 1.629,R$ 2.322
Jaqueta matelassê Himalayan com capuz,The North Face,R$ 3.870,R$ 5.364
Blazer Punto com botões,Karl Lagerfeld,R$ 2.567,R$ 5.122
Blazer Beo,The Frankie Shop,R$ 2.180,R$ 3.625
Jaqueta college Mascot,Represent,R$ 4.223,R$ 6.028
Jaqueta matelassê com capuz,Karl Lagerfeld Jeans,R$ 2.055,R$ 4.097
Jaqueta college com bordado,BARROW,R$ 3.334,R$ 6.655
Jaqueta GORE-TEX®,The North Face,R$ 7.689,R$ 9.911
Jaqueta bomber com patch,BARROW,R$ 3.334,R$ 6.655
Jaqueta bomber V-Emblem de couro,Versace Jeans Couture,R$ 6.873,R$ 9.813
Jaqueta impermeável com estampa,Kenzo,R$ 6.662,R$ 8.985
Blazer com abotoamento duplo,Karl Lagerfeld,R$ 3.519,R$ 7.025
Jaqueta com patch de logo,Napapijri,R$ 3.631,R$ 5.182
Jaqueta Essential de bouclê,Karl Lagerfeld,R$ 3.153,R$ 6.293
Jaqueta La Veste Slogan,Drôle De Monsieur,R$ 2.911,R$ 3.636
Colete matelassê com abotoamento duplo,Karl Lagerfeld,R$ 2.567,R$ 5.122
Jaqueta Angler encerada,Barbour,R$ 4.402,R$ 4.984
Jaqueta bomber com detalhe de aplicação,Karl Lagerfeld,R$ 3.665,R$ 7.318
Jaqueta de couro mangas longas,Belstaff,R$ 6.731,R$ 10.662
Jaqueta bomber com zíper,Burberry,R$ 15.962,R$ 24.551
Blazer com abotoamento simples,Herno,R$ 3.668,R$ 6.073
Jaqueta bomber x Wales Bonner dupla face,adidas,R$ 2.901,R$ 3.624
Jaqueta de couro dupla face,ROUGH.,R$ 8.689,R$ 10.333
Jaqueta Glass Cover-TC,Stone Island,R$ 20.921,R$ 24.878
Jaqueta Retro Nuptse 96,The North Face,R$ 2.351,R$ 3.430
Jaqueta com pelos na gola,ERALDO,R$ 12.010,R$ 24.009
Jaqueta bomber com bordado de texto,Balmain,R$ 8.489,R$ 12.400
Jaqueta com estampa Chromo Couture,Versace Jeans Couture,R$ 4.129,R$ 5.893
Colete Pony com logo,Polo Ralph Lauren,R$ 5.680,R$ 6.373
Jaqueta com padronagem monogramada PB,Balmain,R$ 8.267,R$ 16.900
Jaqueta com capuz,Stone Island,R$ 10.820,R$ 12.728
Jaqueta de lã e cashmere mistos,AMI Paris,R$ 10.667,R$ 11.127
Jaqueta flanelada com bolsos,Stone Island,R$ 11.285,R$ 15.221
Jaqueta TNF x Yinka Ilori,The North Face,R$ 5.633,R$ 6.320
Blazer com abotoamento duplo,OUR LEGACY,R$ 6.332,R$ 8.539
Jaqueta de algodão,Polo Ralph Lauren,R$ 6.003,R$ 6.299
Jaqueta corta-vento com logo bordado,Fred Perry,R$ 2.805,R$ 4.002
Jaqueta bomber de couro,DSQUARED2,R$ 13.492,R$ 25.474
Jaqueta bomber com logo,Dolce & Gabbana,R$ 17.924,R$ 24.859
Jaqueta jeans com estampa Tokyo,Karl Lagerfeld Jeans,R$ 1.469,R$ 2.926
Jaqueta bomber Ami De Coeur,AMI Paris,R$ 5.237,R$ 6.069
Jaqueta com capuz e logo de bússola,Stone Island,R$ 12.681,R$ 13.348
Jaqueta Nuptse matelassê 1992,The North Face,R$ 6.162,R$ 8.509
Jaqueta Retro Denali,The North Face,R$ 1.629,R$ 2.322
Colete Retro Denali,The North Face,R$ 1.214,R$ 1.730
Jaqueta com zíper e estampa barroca,Versace,R$ 18.939,R$ 25.651
Jaqueta Pro-Tek matelassê,C.P. Company,R$ 3.396,R$ 6.889
Jaqueta com patch de logo,Lacoste,R$ 2.424,R$ 3.028
Jaqueta com capuz e patch de bússola,Stone Island,R$ 7.404,R$ 8.225
Jaqueta matelassê com aplicação de logo,Courrèges,R$ 16.985,R$ 20.049
Jaqueta com logo bordado,Martine Rose,R$ 5.065,R$ 8.434
Jaqueta college Ivy,Axel Arigato,R$ 3.972,R$ 5.669
Jaqueta Retro Nuptse 1996,The North Face,R$ 2.831,R$ 4.039
Jaqueta jeans efeito destroyed,DSQUARED2,R$ 4.850,R$ 9.688
Jaqueta esportiva com bordado monogramado,Palm Angels,R$ 4.842,R$ 10.955
Jaqueta jeans,Saint Laurent,R$ 14.031,R$ 15.943
Jaqueta matelassê com capuz,Mackage,R$ 9.169,R$ 20.362
Jaqueta bomber com patch de logo,Études Studio,R$ 4.592,R$ 6.119
Jaqueta bomber de couro,Dell'oglio,R$ 9.356,R$ 14.387
Jaqueta com efeito desbotado,Balenciaga,R$ 20.995,R$ 22.423
Jaqueta corta-vento com patch de bússola,Stone Island,R$ 10.665,R$ 11.226
Blazer de linho com abotoamento simples,Polo Ralph Lauren,R$ 6.411,R$ 12.811
Jaqueta com placa de logo,Herno,R$ 6.622,R$ 9.246
Jaqueta Ispa Butterfly,Nike,R$ 6.122,R$ 7.201
Jaqueta bomber matelassê,DSQUARED2,R$ 6.298,R$ 8.051
Jaqueta com patch de bússola,Stone Island,R$ 9.330,R$ 10.468
Colete matelassê,Valstar,R$ 12.232,R$ 14.388
Jaqueta jeans com zíper,Off-White,R$ 5.704,R$ 13.371
Jaqueta jeans de algodão,Balenciaga,R$ 17.406,R$ 21.755
Jaqueta Billy,GALLERY DEPT.,R$ 23.203,R$ 27.228
Colete com detalhe Goggles,C.P. Company,R$ 6.525,R$ 9.317
Jaqueta esportiva com logo bordado,Palm Angels,R$ 4.051,R$ 6.948
Jaqueta Shell-R com capuz,C.P. Company,R$ 3.712,R$ 5.575
Jaqueta matelassê Polo Pony,Polo Ralph Lauren,R$ 3.739,R$ 4.429
Colete Ami de Coeur matelassê,AMI Paris,R$ 7.927,R$ 10.844
Jaqueta bomber de cetim com tag de logo,Dolce & Gabbana,R$ 7.800,R$ 13.000
Jaqueta com patch de bússola,Stone Island,R$ 10.820,R$ 12.021
Colete Garson matelassê,Canada Goose,R$ 9.983,R$ 13.788
Jaqueta esportiva color block,Moschino,R$ 5.457,R$ 10.902
Jaqueta com capuz e zíper,Balenciaga,R$ 21.281,R$ 25.120
Colete Gorham,Polo Ralph Lauren,R$ 5.810,R$ 7.260
Colete com detalhe Goggles,C.P. Company,R$ 5.239,R$ 7.479
Jaqueta college de veludo cotelê com recortes,AMIRI,R$ 11.516,R$ 23.737
Jaqueta de couro,Salvatore Santoro,R$ 19.902,R$ 27.047
Jaqueta jeans com logo bordado,Who Decides War,R$ 7.660,R$ 11.053
Jaqueta com logo gravado,Emporio Armani,R$ 19.297,R$ 25.726
