Produto,Marca,Preço,Preço Original,Desconto,Categoria Luxo,Media,Desconto Percentual,Classificação
Jaqueta de algodão,Polo Ralph Lauren,4575,5376,0.149,Luxoso,Baixa,14.9,Jaqueta
Jaqueta bomber Chenille Patchwork,Casablanca,15388,20504,0.2495,Muito Luxuoso,Alta,24.95,Jaqueta
Jaqueta matelassê leve,DSQUARED2,3339,5586,0.4023,Luxoso,Baixa,40.23,Jaqueta
Jaqueta bomber com patch,BARROW,2329,4615,0.4953,Luxoso,Baixa,49.53,Jaqueta
Jaqueta matelassê com logo,DSQUARED2,4175,6990,0.4027,Luxoso,Baixa,40.27,Jaqueta
Jaqueta bomber College de cetim,Off-White,10985,15676,0.2992,Muito Luxuoso,Alta,29.92,Jaqueta
Jaqueta de camurça,Lardini,22043,29378,0.2497,Muito Luxuoso,Alta,24.97,Jaqueta
Jaqueta bomber de couro com zíper,SANDRO,4790,9620,0.5021,Luxoso,Baixa,50.21,Jaqueta
Jaqueta com abotoamento simples,SANDRO,2146,3580,0.4006,Luxoso,Baixa,40.06,Jaqueta
Jaqueta de pelos,SANDRO,5325,10700,0.5023,Luxoso,Baixa,50.23,Jaqueta
Camisa com zíper,SANDRO,2556,3665,0.3026,Luxoso,Baixa,30.26,Camisa
Jaqueta com padronagem monogramada PB,Balmain,10069,16900,0.4042,Muito Luxuoso,Alta,40.42,Jaqueta
Jaqueta com acabamento de feltro,SANDRO,1119,2215,0.4948,Pouco Luxoso,Baixa,49.48,Jaqueta
Jaqueta bomber Maison Pastelle,Casablanca,13826,18421,0.2494,Muito Luxuoso,Alta,24.94,Jaqueta
Jaqueta matelassê com patch de logo,DSQUARED2,8494,16946,0.4988,Luxoso,Alta,49.88,Jaqueta
Jaqueta corta-vento Barocco Sea com capuz,Versace,14042,20042,0.2994,Muito Luxuoso,Alta,29.94,Jaqueta
Jaqueta bomber com logo,Off-White,12991,16370,0.2064,Muito Luxuoso,Alta,20.64,Jaqueta
Jaqueta TNF x Yinka Ilori,The North Face,4762,5596,0.149,Luxoso,Baixa,14.9,Jaqueta
Jaqueta com patch de bússola,Stone Island,7841,9217,0.1493,Luxoso,Alta,14.93,Jaqueta
hooded puffer jacket,Add,5196,7972,0.3482,Luxoso,Baixa,34.82,Diferentes
Jaqueta com zíper,Peserico,9251,13198,0.2991,Luxoso,Alta,29.91,Jaqueta
Jaqueta bomber V-Emblem de couro,Versace Jeans Couture,6154,8191,0.2487,Luxoso,Baixa,24.87,Jaqueta
Jaqueta matelassê com logo,Off-White,13997,23300,0.3993,Muito Luxuoso,Alta,39.93,Jaqueta
Blazer xadrez tartan com abotoamento,ETRO,12457,20734,0.3992,Muito Luxuoso,Alta,39.92,Blazer
Jaqueta de couro com zíper,Acne Studios,12894,21462,0.3992,Muito Luxuoso,Alta,39.92,Jaqueta
Jaqueta bomber com logo gravado,DSQUARED2,9479,15771,0.399,Luxoso,Alta,39.9,Jaqueta
Jaqueta matelassê,SANDRO,2715,5435,0.5005,Luxoso,Baixa,50.05,Jaqueta
Blazer com lapelas e abotoamento duplo,SANDRO,2356,4710,0.4998,Luxoso,Baixa,49.98,Blazer
Jaqueta esportiva color block,Moschino,4615,9187,0.4977,Luxoso,Baixa,49.77,Jaqueta
Jaqueta matelassê com patch de bússola,Stone Island,11940,14040,0.1496,Muito Luxuoso,Alta,14.96,Jaqueta
Jaqueta de couro com estampa,Moschino,13149,26256,0.4992,Muito Luxuoso,Alta,49.92,Jaqueta
Jaqueta bomber de camurça,SANDRO,5189,10425,0.5023,Luxoso,Baixa,50.23,Jaqueta
Jaqueta matelassê com capuz,Karl Lagerfeld Jeans,1757,3473,0.4941,Pouco Luxoso,Baixa,49.41,Jaqueta
Jaqueta com zíper,SANDRO,2245,3745,0.4005,Luxoso,Baixa,40.05,Jaqueta
Jaqueta bomber de couro,Versace,22792,32542,0.2996,Muito Luxuoso,Alta,29.96,Jaqueta
Jaqueta Reelin,Barbour,4032,4737,0.1488,Luxoso,Baixa,14.88,Jaqueta
Jaqueta bomber Bernardo,Vivienne Westwood,8333,9797,0.1494,Luxoso,Alta,14.94,Jaqueta
Jaqueta de lã com abotoamento,AMI Paris,4861,6067,0.1988,Luxoso,Baixa,19.88,Jaqueta
Jaqueta 4 Ganci,Fay,9695,14893,0.349,Luxoso,Alta,34.9,Jaqueta
Jaqueta blouson com zíper e capuz,Emporio Armani,4157,5529,0.2481,Luxoso,Baixa,24.81,Jaqueta
Blazer xadrez com abotoamento simples,ETRO,14648,19517,0.2495,Muito Luxuoso,Alta,24.95,Blazer
Jaqueta com forro matelassê,SANDRO,2771,4630,0.4015,Luxoso,Baixa,40.15,Jaqueta
Jaqueta esportiva Blanket,Martine Rose,5529,9187,0.3982,Luxoso,Baixa,39.82,Jaqueta
Jaqueta com patch de bússola,Stone Island,7279,10381,0.2988,Luxoso,Alta,29.88,Jaqueta
Jaqueta bomber dupla face,Kenzo,10477,14950,0.2992,Muito Luxuoso,Alta,29.92,Jaqueta
Jaqueta corta-vento com patch de bússola,Stone Island,6699,9553,0.2988,Luxoso,Baixa,29.88,Jaqueta
Jaqueta bomber de couro,Dell'oglio,8492,12113,0.2989,Luxoso,Alta,29.89,Jaqueta
Jaqueta Mate,Zadig&Voltaire,5583,9278,0.3983,Luxoso,Baixa,39.83,Jaqueta
Jaqueta matelassê com zíper,SANDRO,3448,4950,0.3034,Luxoso,Baixa,30.34,Jaqueta
Jaqueta Skidoo com capuz,Napapijri,6320,9700,0.3485,Luxoso,Baixa,34.85,Jaqueta
Blazer com abotoamento duplo,Versace,17965,25647,0.2995,Muito Luxuoso,Alta,29.95,Blazer
Jaqueta bomber La Coupe des Dieux dupla face,Versace,16685,25647,0.3494,Muito Luxuoso,Alta,34.94,Jaqueta
Jaqueta com placa de logo,Herno,6211,8855,0.2986,Luxoso,Baixa,29.86,Jaqueta
Jaqueta com patch de bússola,Stone Island,9524,11606,0.1794,Luxoso,Alta,17.94,Jaqueta
Jaqueta matelassê com botões,Herno,8069,10467,0.2291,Luxoso,Alta,22.91,Jaqueta
Jaqueta leve com recortes,DSQUARED2,12396,17691,0.2993,Muito Luxuoso,Alta,29.93,Jaqueta
Jaqueta matelassê com patch de bússola,Stone Island,5367,7650,0.2984,Luxoso,Baixa,29.84,Jaqueta
Colete matelassê com zíper,Lacoste,3226,4591,0.2973,Luxoso,Baixa,29.73,Colete
Jaqueta matelassê monogramada com capuz,Palm Angels,11890,18270,0.3492,Muito Luxuoso,Alta,34.92,Jaqueta
Jaqueta Link com abotoamento,Boggi Milano,1864,3079,0.3946,Pouco Luxoso,Baixa,39.46,Jaqueta
Jaqueta bomber de couro,Dolce & Gabbana,13500,22500,0.4,Muito Luxuoso,Alta,40.0,Jaqueta
Jaqueta esportiva Varsity,Casablanca,8674,13322,0.3489,Luxoso,Alta,34.89,Jaqueta
Jaqueta matelassê com logo bordado,Moschino,4279,8517,0.4976,Luxoso,Baixa,49.76,Jaqueta
Blazer com abotoamento simples,SANDRO,1796,3580,0.4983,Pouco Luxoso,Baixa,49.83,Blazer
Jaqueta bicolor,Balmain,23764,27951,0.1498,Muito Luxuoso,Alta,14.98,Jaqueta
Jaqueta de lã com monograma,SANDRO,2197,3665,0.4005,Luxoso,Baixa,40.05,Jaqueta
Jaqueta biker L-Metalo de couro,Diesel,7685,9597,0.1992,Luxoso,Alta,19.92,Jaqueta
Jaqueta matelassê com capuz,Herno,5199,6918,0.2485,Luxoso,Baixa,24.85,Jaqueta
Parka encerada,Barbour,5121,7297,0.2982,Luxoso,Baixa,29.82,Diferentes
Jaqueta matelassê com aplicação de logo,Courrèges,14173,15744,0.0998,Muito Luxuoso,Alta,9.98,Jaqueta
Jaqueta blouson com zíper e capuz,Emporio Armani,4660,5475,0.1489,Luxoso,Baixa,14.89,Jaqueta
Jaqueta jeans matelassê,Karl Lagerfeld Jeans,1757,3473,0.4941,Pouco Luxoso,Baixa,49.41,Jaqueta
Jaqueta matelassê com patch de logo,Blauer,3739,4664,0.1983,Luxoso,Baixa,19.83,Jaqueta
Jaqueta esportiva color block monogramada,Palm Angels,3990,7937,0.4973,Luxoso,Baixa,49.73,Jaqueta
Jaqueta Ami De Coeur matelassê,AMI Paris,11824,14770,0.1995,Muito Luxuoso,Alta,19.95,Jaqueta
Jaqueta de fleece,Stone Island,5057,11186,0.5479,Luxoso,Baixa,54.79,Jaqueta
Jaqueta com capuz e logo bordado,DSQUARED2,3339,5586,0.4023,Luxoso,Baixa,40.23,Jaqueta
Jaqueta Bedale encerada,Barbour,4334,5408,0.1986,Luxoso,Baixa,19.86,Jaqueta
Moletom Dynamic Athlete VENTUS7 com capuz,Ea7 Emporio Armani,1152,1750,0.3417,Pouco Luxoso,Baixa,34.17,Diferentes
Colete gola V,Barbour,1804,2116,0.1474,Pouco Luxoso,Baixa,14.74,Colete
Jaqueta Angler encerada,Barbour,4352,6200,0.2981,Luxoso,Baixa,29.81,Jaqueta
Jaqueta matelassê com patch de logo,DSQUARED2,11674,19429,0.3991,Muito Luxuoso,Alta,39.91,Jaqueta
Jaqueta Plymouth Mechanic,Deus Ex Machina,1620,2469,0.3439,Pouco Luxoso,Baixa,34.39,Jaqueta
Jaqueta Jaman com zíper,Napapijri,3883,4310,0.0991,Luxoso,Baixa,9.91,Jaqueta
Jaqueta college Mascot,Represent,3670,5225,0.2976,Luxoso,Baixa,29.76,Jaqueta
Jaqueta x Yinka Ilori,The North Face,5040,5596,0.0994,Luxoso,Baixa,9.94,Jaqueta
Jaqueta com patch de bússola,Stone Island,7468,10650,0.2988,Luxoso,Alta,29.88,Jaqueta
Jaqueta Eco Chrome-R,C.P. Company,6827,9736,0.2988,Luxoso,Baixa,29.88,Jaqueta
Jaqueta impermeável com capuz,Rains,935,1035,0.0966,Pouco Luxoso,Baixa,9.66,Jaqueta
Jaqueta bomber Detroit,Carhartt WIP,2092,2605,0.1969,Luxoso,Baixa,19.69,Jaqueta
Jaqueta com bolsos no busto,Hogan,5078,7236,0.2982,Luxoso,Baixa,29.82,Jaqueta
Blazer com abotoamento duplo,Karl Lagerfeld,2987,5931,0.4964,Luxoso,Baixa,49.64,Blazer
Jaqueta matelassê com sobreposição,DSQUARED2,12109,20154,0.3992,Muito Luxuoso,Alta,39.92,Jaqueta
Jaqueta impermeável com estampa,Kenzo,5535,7889,0.2984,Luxoso,Baixa,29.84,Jaqueta
Jaqueta com recortes em tricô,Herno,6591,9398,0.2987,Luxoso,Baixa,29.87,Jaqueta
Jaqueta bomber com patch de logo,Études Studio,3079,6117,0.4966,Luxoso,Baixa,49.66,Jaqueta
